{
  "schema_version": "CLARITYLINK-VEHICLE-TEST-MATRIX-1",
  "repository": "bmreyes25/ClarityLink",
  "pull_request": 19,
  "branch": "architecture/r7e-parked-car-compatibility-preparation",
  "starting_head": "a973cd8883624e4f064f30e478de5cec2d54bbe7",
  "planning_only": true,
  "authorization_in_force": false,
  "candidates": [
    {
      "test_id": "V0-PASSIVE-BASELINE",
      "status": "READY_FOR_INDEPENDENT_REVIEW_PASSIVE_ONLY",
      "retry_count": 0,
      "fallback_count": 0,
      "execution_in_this_milestone": false,
      "objective": "Document normal parked center-display and cluster condition, navigation-page availability, and only visibly apparent layout boundaries before later tests.",
      "current_unknown": "No current baseline observation in this checkout; visible extents are not calibrated physical geometry.",
      "required_evidence": ["Completed passive-observation schema", "Local-offset observation time and method", "Optional unedited camera media with SHA-256 stored privately", "Measured versus visually estimated labels and uncertainty"],
      "expected_information_gain": "High for current state and operator stop preconditions; low for physical geometry; none for process or interface proofs.",
      "vehicle_contact_required": true,
      "adb_required": false,
      "target_write_required": false,
      "target_execution_required": false,
      "root_required": false,
      "apk_install_required": false,
      "carplay_session_required": false,
      "risk_classification": "LOW_PASSIVE_WITH_OPERATOR_AND_PRIVACY_RISK",
      "existing_artifacts": [
        {"path": "research/vehicle/passive-observation.schema.json", "sha256": "187c5c87bdcf5e0f20ebab8cf81c3e87f131d529c64ed5e86a87241480880970", "role": "evidence schema"},
        {"path": "research/vehicle/passive-observation-template.json", "sha256": "08959ae82f407e6669a999de7a12e631f6b629ce22c75a0f4119582cad3e0883", "role": "blank template"},
        {"path": "research/architecture/p2c4-cluster-safe-area.md", "sha256": "a26fb883cd507c26df575c990062e74e5837a20befe8c1d8f0863479c29586b8", "role": "existing logical/physical boundary review"}
      ],
      "proposed_commands": [],
      "authorization_requirements": ["New single-use V0 user authorization", "Exact date/session and current PR HEAD", "Operator confirms stationary safely parked state, appropriate brake, normal displays and no warnings", "No ADB, settings change, session change, vehicle operation or test pattern"],
      "stop_conditions": ["Any warning or abnormal cluster/center display", "Vehicle movement", "Operator distraction", "Privacy concern", "Any request to connect, disconnect, change settings or perform a diagnostic"],
      "success_criteria": ["State fields completed", "Each feature is identified as measured, estimated, reported or unobserved", "Optional media is unedited, hash-recorded and privately stored", "No vehicle state was changed"],
      "failure_criteria": ["Vehicle is not stationary/safely parked", "Unexpected warning/abnormal state", "Evidence cannot distinguish estimate from measurement", "Privacy or operator safety condition is not met"],
      "decision_changes_if_successful": "Establishes the current visible baseline and whether later observation should be stopped before starting; does not clear any recovery or architecture gate.",
      "what_remains_unproven": ["Historical process termination", "Current process absence or no-relaunch", "Exact file absence", "Physical safe area/transform", "Warning layer precedence", "Window admission", "Authentic secondary navigation ingress"],
      "recovery_requirements": "No restoration; observation-only. End recording, secure private media, and review before another scope.",
      "evidence_storage": "Private local directory outside Git; restrict permissions; retain original bytes and SHA-256; redact/share only a separately reviewed copy."
    },
    {
      "test_id": "V1-HISTORICAL-TERMINATION",
      "status": "BLOCKED_PHASE_S_BLOCKED",
      "retry_count": 0,
      "fallback_count": 0,
      "execution_in_this_milestone": false,
      "objective": "Use current boot identity and uptime only to determine whether the exact historical Test A invocation necessarily predates the current kernel boot.",
      "current_unknown": "No defensible historical clock-error upper bound or genuine current clock attestation; old failure has no old PID or boot ID.",
      "required_evidence": ["Independent authenticated historical chronology with explicit maximum clock error", "Fresh current-host clock uncertainty evidence", "Independently reviewed hash-bound attestation and reviewer key provenance", "Exact frozen collector/manifest hashes", "Exact operator-confirmed serial and parked preconditions"],
      "expected_information_gain": "Potentially decisive for historical termination if and only if the conservative boot-time inequality is supported; otherwise none.",
      "vehicle_contact_required": true,
      "adb_required": true,
      "target_write_required": false,
      "target_execution_required": true,
      "root_required": false,
      "apk_install_required": false,
      "carplay_session_required": false,
      "risk_classification": "HIGH_READ_ONLY_ADB_AND_CLOCK_PROOF_DEPENDENCY",
      "existing_artifacts": [
        {"path": "research/runtime/r7e7i-phase-s-manifest.json", "sha256": "6074ddfd76c35ae5a194e92b087c1b636971981a3a0fd59ed0fb5c53733d2619", "role": "frozen command manifest, inactive"},
        {"path": "tools/r7e7i_phase_s_collector.py", "sha256": "272c7de0222315bbd5909c7d79061f1477c177996be55b926978dbca2d693098", "role": "default-disabled collector, inactive"},
        {"path": "research/runtime/r7e7i-remediation-closeout.md", "sha256": "fd9a5a7c1f5c758038d861bdcd0f8066e11028e3f8cce29d8fd7daf7872668a7", "role": "latest blocker decision"}
      ],
      "proposed_commands": [],
      "authorization_requirements": ["All clock and provenance gates above pass", "Exact frozen package re-reviewed", "New independent safety review", "New single-use Phase S authorization naming HEAD, hashes, exact serial, time bounds, expiry and operator checks"],
      "stop_conditions": ["Missing/expired/untrusted clock evidence", "Any package/hash/serial mismatch", "Any timeout or malformed/unexpected output", "Clock step", "Boot ID changes between reads", "Any transport anomaly"],
      "success_criteria": ["Only exact frozen 5-command sequence succeeds", "Same boot ID brackets a valid uptime read", "Conservative current boot lower bound exceeds prior invocation upper bound by the specified margin", "Private evidence binds command outputs and package hashes"],
      "failure_criteria": ["Any uncertainty or failed gate", "Inequality not satisfied", "Incomplete evidence", "Any command result outside exact grammar"],
      "decision_changes_if_successful": "May establish termination of the prior invocation before this boot; does not establish current absence, no later relaunch, file absence or cleanup safety.",
      "what_remains_unproven": ["Current process references", "Relaunch routes", "Fresh exact file identity", "Exact path absence", "Phase C readiness", "Test A readiness"],
      "recovery_requirements": "No target recovery command; stop at first failure, preserve private evidence, no retry/fallback or automatic V2 transition.",
      "evidence_storage": "Collector's private mode-0700 directory and mode-0600 evidence only; never commit raw vehicle evidence."
    },
    {
      "test_id": "V2-CURRENT-PROCESS-AND-RELAUNCH",
      "status": "BLOCKED_NO_COMPLETE_UNPRIVILEGED_INSPECTION_CONTRACT",
      "retry_count": 0,
      "fallback_count": 0,
      "execution_in_this_milestone": false,
      "objective": "Determine whether the exact historical executable inode is currently referenced and whether a credible relaunch mechanism remains.",
      "current_unknown": "Honda shell visibility/permissions, exact per-process exe/maps/fd coverage, inventory stability, PID generations and relaunch routes are unknown.",
      "required_evidence": ["Exact target device/inode identity", "Complete same-boot process coverage with unreadable entries reported", "PID/starttime generation and exe/maps/fd evidence", "Two stable inventories or justified race-free method", "Independent no-relaunch review", "Exact Honda shell permission evidence"],
      "expected_information_gain": "Potentially decisive for current references if complete visibility is proven; partial output is inconclusive and cannot change cleanup readiness.",
      "vehicle_contact_required": true,
      "adb_required": true,
      "target_write_required": false,
      "target_execution_required": true,
      "root_required": false,
      "apk_install_required": false,
      "carplay_session_required": false,
      "risk_classification": "HIGH_PERMISSION_AND_PROCESS_VISIBILITY_RISK",
      "existing_artifacts": [
        {"path": "research/runtime/r7e7i-current-process-evidence-contract.md", "sha256": "b276a05b0bad295ec3320fb8b0492e645285ec8e6e471c1e1a3b05bbd861528f", "role": "offline evidence contract"},
        {"path": "research/runtime/r7e7i-process-safety-recovery-report.md", "sha256": "a9626885f799b4c1aae975fdcdc7bd0bb9eb419d9e60b591338784bffad6f443", "role": "process safety decision tree"}
      ],
      "proposed_commands": [],
      "authorization_requirements": ["Offline proof that a narrow Android 4.2.2 method can meet completeness requirements", "Exact reviewed command manifest and hash", "Independent safety review", "New single-use V2 authorization, separate from V1"],
      "stop_conditions": ["Any unreadable process/object", "Permission denied", "Malformed procfs", "PID inventory/starttime change", "Boot ID change", "Target identity change", "Unexpected relaunch", "Timeout or transport anomaly"],